Goal,Subgoal,Data Layer,Name,File,Brief Description,Metadata,Start Year,End Year,Reference,url,bib,bib2
LE,LIV,ocean and coastal jobs,le_jobs,le_jobs_whi2018.csv,The total number of jobs per ocean sector for Hawaii County.,"The total number of jobs per ocean sector for Hawaii County. Data comes from the NOAA ENOW database (https://coast.noaa.gov/digitalcoast/tools/enow.html). Dataset covers from 2005-2014 and is at the County scale. Sectors include: Marine Construction, Living Resources, Ship and Boat Building, Tourism and Recreation, and Marine Transportation (Table #).  Self-employed and state employed data sets were aggregated and summarized by county. However, when aggregated to county some of the information was undisclosed therefore this data represents a conservative estimate of ocean livelihoods. Blank values indicate that no data is available for that sector and year (the number of employed in the sector is too low to report and maintain confidentiality or there were no employees in that sector).",2005,2013,NOAA ENOW ,https://coast.noaa.gov/digitalcoast/tools/enow.html,ENOW2017,
LE,ECO,ocean and coastal revenue,le_gdp,le_gdp_whi2018.csv,The revenue generated per ocean sector for Hawaii County.,"The total revenue per ocean sector for Hawaii County. Data comes from the NOAA ENOW database (https://coast.noaa.gov/digitalcoast/tools/enow.html). Dataset covers from 2005-2014 and is at the County scale. Sectors include: Marine Construction, Living Resources, Ship and Boat Building, Tourism and Recreation, and Marine Transportation (Table #).  Data sets were aggregated and summarized by county. However, when aggregated to county some of the information was undisclosed therefore this data represents a conservative estimate of ocean economies. Blank values indicate that no data is available for that sector and year. ",2005,2013,NOAA ENOW ,https://coast.noaa.gov/digitalcoast/tools/enow.html,ENOW2017,
LE,ECO,ocean and coastal sector mean wages,le_wage,le_wages_whi2018.csv,The mean wage per ocean sector for Hawaii County.,"The average wage per ocean sector for Hawaii County. Data comes from the NOAA ENOW database (https://coast.noaa.gov/digitalcoast/tools/enow.html). Average wage was calculated by dividing the total wages per sector by the number employed per sector. Dataset covers from 2005-2014 and is at the County scale. Sectors include: Marine Construction, Living Resources, Ship and Boat Building, Tourism and Recreation, and Marine Transportation (Table). Self-employed and state employed data sets were aggregated and summarized by county. However, when aggregated to county some of the information was undisclosed therefore this data represents a conservative estimate of ocean economies. Blank values indicate that no data is available for that sector and year. ",,,NOAA ENOW ,https://coast.noaa.gov/digitalcoast/tools/enow.html,ENOW2017,
FP,MAR,operations,mar_operations,mar_operations_whi2018.csv,The number of mariculture operators.,"The number of shellfish and finfish operators in Hawaii county reported to the USDA via the census every 5 years (2002, 2007, 2012) (USDA). Data available: https://quickstats.nass.usda.gov/. To fill in annual data gaps linear regression models were used.",2002,2011,USDA,https://quickstats.nass.usda.gov/,USDA,
FP,FIS,commerical pelagic fisheries  catch,fis_pelagic_catch,fis_pelagic_catch_whi2018.csv,Pelagic fish catch (lbs.) reported in the commercial fishery.,"The pelagic fish catch (lbs.) reported in the commercial fishery. Data comes from DLNR DAR by official data request. Annual catch data is reported to species and region (North West Hawaii (DAR commercial reporting blocks 123, 122, 103, and 102) and South West Hawaii (DAR commercial reporting blocks 121, 120, 101, and 100) from 2012-2017. Raw data available: https://github.com/OHI-Science/whi/blob/master/prep_whi/FIS/FW%253a_fisheries_data_request/ciwhiispecies2012_2017.xls.",2012,2016,DLNR-DAR,http://dlnr.hawaii.gov/dar/fishing/commercial-fishing/,DLNRDAR,
BD,HAB,reef condition,hab_health_whi,hab_health_whi2018.csv,"The benthic condition of coral reefs assessed through a combination of variables including percent coral cover, percent macroalgae cover, demography, and mortality.","Coral reef extent was assessed from the cumulative impact mapping layers that combine hard bottom and coral reef habitats to a depth of 30 meters (Lecky, 2016). Coral reef condition was assessed through a coral reef index, which is a measure of coral reef health from combined indicators for coral cover, macroalgae (limu), coralline algae, and the ratio of calcifiers (corals and coralline algae) to non calcifiers (limu), coral mortality, juvenile coral density, and adult coral density. The coral reef index comes from the NOAA Hawai'i coral reef status report (NOAA in prep).",,,NOAA report card,in review,NOAACoralReefConservationProgramandUniversityofMarylandCenterforEnvironmentalScience,
BD,HAB,reef extent,hab_extent_whi,hab_extent_whi2018.csv,The hard bottom extent out to 30 meters modified from NOAA habitat maps.,"Coral reef extent was assessed from the cumulative impact mapping layers that combine hard bottom and coral reef habitats to a depth of 30 meters (Lecky, 2016). ",,,Lecky 2016 Ecosystem vulnerability and mapping cumulative impacts on Hawaiian reefs,,Lecky2016,
PRESSURE,,reef fishing catch,fp_reeffish_t,fp_reeffish_t_whi2018.csv,The modeled reef fish catch from commercial and recreational fishery taking into account shoreline accessibility (kg per km2).,The modeled reef fish catch from commercial and recreational fishery taking into account shoreline accessibility (kg per km2). Data comes from Ocean Tipping Points (http://www.pacioos.hawaii.edu/projects/oceantippingpoints/#data).,,,Ocean Tipping Points,http://www.pacioos.hawaii.edu/projects/oceantippingpoints/#data,Wedding2017,OTP
BD,HAB,reef trend,hab_trend_whi,hab_trend_whi2018.csv,The estimated change in percent coral cover calculated from the past 5 years of available monitoring data from NOAA Coral Reef Ecosystem Program.,"Trend in coral reef health was assessed as the change in coral cover from 2011-2012 to 2016 surveys from the Main Hawaiian Islands (McCoy et al., 2017).",,,NOAA CREP 2017 Report,https://www.pifsc.noaa.gov/cred/monitoring_status_reports.php,McCoy2017,
TR,,resident sentiment,t_sentiment,t_sentiment_whi2018.csv,The Hawaii Tourism Authority's survey on resident sentiment to tourism.,"Resident sentiment scores on the preservation of social and cultural values estimated though HTA visitor sentiment surveys (HTA, 2017). Data available: http://www.hawaiitourismauthority.org/research/reports/evaluation-performance-measures/. Contact for official datasets from the Hawaii Tourism Authority is Jennifer Chun (jennifer@gohta.net). Three questions have been asked consistently and thus have time-series information. Responses to these questions were used to score the sentiment of residents on the benefits and impact of tourism in Hawaiʻi. The three questions were to rate the level of impact and agreement on: 1. Rate the overall impact of tourism on your family, 2. Tourism has brought more benefits than problems, and 3. The island is being run for the tourists at the expense of the local people. The three questions were normalized to a score from 0 to 100 with 100 being positive or agreement on positive impacts of tourism for residence of Hawaiʻi. Questions were averaged and scored to a reference value of 80 as set by the Hawaiʻi Tourism Authority as their target acceptance rate (HTA, 2017).",2011,2015,HTA,http://www.hawaiitourismauthority.org/research/reports/visitor-satisfaction/,hta_survey_2017,HTA evaluation and performance measures
BD,HAB,soft bottom condition,hab_health_whi,hab_health_whi2018.csv,The percent of soft bottom habitat not impacted by dredging.,"Nearshore soft bottom habitat extent was mapped to a depth of 30 meters (Lecky, 2016). The condition was measured as the proportion of soft bottom habitat that was not dredged. Dredging was defined as activity involving physically removing substrate with machinery typically to allow for safe passage of vessels (Lecky, 2016). Dredging layer is available on the Hawai‘i Office of Planning Hawai‘i Statewide GIS Program geospatial database (http://geoportal.hawaii.gov/).",,,Lecky 2016 Ecosystem vulnerability and mapping cumulative impacts on Hawaiian reefs,,Lecky2016,
BD,HAB,soft bottom extent,hab_extent_whi,hab_extent_whi2018.csv,Soft bottom habitat extent was derived from the cumulative impact habitat maps.,"Soft bottom habitat extent was derived from the cumulative impact habitat maps, with nearshore soft bottom habitat extent mapped to a depth of 30 meters (Lecky, 2016).",,,Lecky 2016 Ecosystem vulnerability and mapping cumulative impacts on Hawaiian reefs,,Lecky2016,
FP,FIS,sustainability of bottomfish fishery,fis_sus,fis_sus_updated_whi2018.csv,Bottom fish stock assessment. ,"Bottom fish stock assessment. The bottomfish species sustainability reference point was B/BMSY, with a reference value of 1.0. Bottomfish stocks were assessed as a species complex (Langseth et al., 2018).",,2018,NOAA,https://repository.library.noaa.gov/view/noaa/17252,Langseth2018,
FP,FIS,sustainability of pelagic fishery,fis_sus,fis_sus_updated_whi2018.csv,Pelagic (tuna and swordfish) stock assessments.,"Pelagic fish stock assessment. The pelagic fish sustainability reference point was SB/SBmsy, with a reference value of 1.0. The most recent stock assessments for pelagic fish species were variable but ranged from 2012 to 2017 (WCPFC; ISC, 2017). If stock status was not assessed up to 2016, the ten most recent years of stock assessment data was used to run a linear regression model to predict stock status to 2016. If stock status was non-linear then the mean stock status was used. Stock assessments available: https://github.com/OHI-Science/whi/tree/master/prep_whi/FIS/Stock%20Assessment%20Reports. ",2014,2017,"International Scientific Committee for Tuna and Tuna-like Species in the North Pacific Ocean (ISC), WCPFC",http://isc.fra.go.jp/recommendation/index.html,WCPFC,ISC
FP,FIS,sustainability of reef fishery,fis_sus,fis_sus_updated_whi2018.csv,Reef fish stock assessment.,"Reef fish stock assessment status (Nadon, 2017). Stock status scores are listed by year but are the representative values from the Nadon 2017 reef fish stock assessment report. Scientific species names and full data available: https://github.com/OHI-Science/whi/blob/master/prep_whi/FIS/fis_reef_stock_sustainability.xlsx. ",,2017,NOAA,https://repository.library.noaa.gov/view/noaa/13291,Nadon,
TR,,visitor arrivals,t_visitor_arrivals,t_visitor_arrivals_whi2018.csv,"The total visitor arrivals to Kona, Hawaii.","The total visitor arrivals to Kona, Hawaii from 2012-2016. Data comes from DBEDT state databooks section 7 “recreation and travel.” Databooks available at: http://dbedt.hawaii.gov/economic/databook/db2016/. ",2012,2016,DBEDT,http://dbedt.hawaii.gov/economic/databook/db2016/,DBEDT,
TR,,visitor contributed GDP,t_growth,t_growth_whi2018.csv,Visitor generated GDP standardized to real dollars. ,Data comes from DBEDT databook section 7 “tourism and recreation”. Visitor generated total expenditures was estimated to Hawaii county by weighting expenditures by the average daily number of visitors to each county (visitors defined as overnight stays (DBEDT 2016). Visitor expenditures were adjusted by inflation by the implicit price deflator (DBEDT 2016). Data range is from 2010-2016.,2011,2016,DBEDT,http://dbedt.hawaii.gov/economic/databook/db2016/,DBEDT,
RESILIENCE,,watershed partnerships,watershed_partnerships,hab_watershed_partnerships_whi2018.csv,The ratio of watershed partnerships to historic native forest extent for the island of Hawaii.,"The ratio of watershed partnerships to historic native forest extent (res_score) for the island of Hawaii. Watershed Partnerships spatial data layer (source: DLNR:DOFAW) available: http://geoportal.hawaii.gov/datasets/watershed-partnerships) was used to calculate the area (km2) of watershed partnerships for Hawaii Island (layers_whi/hab_watershed_partnerships.csv). The TNC “GRIM” dataset (prep_WHI/CS_CP_HAB/watershed_partnerships_percent_of_watershed.csv) was used to estimate historical native forest extent for Hawaii Island (10,458.9 km2). ",,,Habitat Partnerships,http://hawp.org/about-us/accomplishments/ and http://geoportal.hawaii.gov/datasets/watershed-partnerships,OfficeofPlanning,
RESILIENCE,,watersheds protected,hd_watersheds,hd_watersheds_whi2018.csv,The percent of priority watersheds that are fenced to protect against invasive animals on Hawaii Island.,The percent of priority watersheds that are fenced to protect against invasive animals on Hawaii Island. Data from Emma Yuen DLNR/DOFAW.,,,DLNR,,Yuen2017,
FP,MAR,mariculture risk,mar_risk,mar_risk_wh2018.csv,Developed scale for the Hawaii Ocean Health Index on the combined sustainability/risk score for mariculture species in Hawaii.,"Developed scale for the Hawaii Ocean Health Index on the combined sustainability/risk score for mariculture species in Hawaii. The species that are reported on the State Department of Land and Natural Resources Division of Aquatic Resources that are produced locally for seafood consumption include: Abalone (Haliotus sp), oysters (Crassostrea gigas and Crassostrea sikamea), clams (Venerupis philippinarum), kahala (Seriola dumerili), Pacific White Shrimp (Penaeus vannamei), and limu (Gracilaria sp.). Moi (Pacific Threadfin) is not on the State of Hawaiʻi Department of Agriculture list but it is produced locally for out planting in fishponds. The sustainability of the species produced was assessed as the average of the feed sustainability score (0 protein based, 1 plant based; 0 imported feed, 1 local feed) and the biosecurity risk scored as species status (1 native, 0.75 introduced, or 0 invasive) and the pathogen and virus susceptibility (0 highly susceptible, 0.5 susceptible but preventative measures in place (biosecurity practices such as sterilization and wastewater treatment practices).",,,Hawaii OHI,http://ohi-science.org/mhi/,,
RESILIENCE,,historical sites,res_historical_sites,res_historic_sites_whi2018.csv,The number of preserved historic sites on Hawaii Island from the Hawaii State Historic Preservation Plan October 2012 to October 2017.,,,, Hawaii State Historic Preservation Plan October 2012 to October 2017,https://health.hawaii.gov/cwb/files/2013/05/Draft-2016-State-of-Hawaii-Water-Quality-Monitoring-and-Assessment-Report.pdf,,