Goal,Subgoal,Data Layer,Name,File,Brief Description,Metadata,Start Year,End Year,Reference,url,bib,bib2
AO,,access to boat launch,res_access_boat,res_boat_access_whi2018.csv,The distance to the nearest boat launch within state waters (3nm).,"The mean distance to the nearest boat launch within state waters (3nm) where fishing is allowed. Mean distance (m) to the nearest boating facility (small boat harbors and launch ramps) within different study areas. Distance was calculated using the cost allocation tool at 100m resolution where land pixels have prohibitive cost and therefore travel is only possible over water. Full no-take MPAs, MPAs that do not all boat access or boat-based fishing, and military areas were set to zero on the distance surface. Data was modified from layers used in the Ocean Tipping Points (http://www.pacioos.hawaii.edu/projects/oceantippingpoints/#data) (Wedding et al 2017).",,,Modified from Ocean Tipping Points,http://www.pacioos.hawaii.edu/projects/oceantippingpoints/#data,Wedding2017,
AO,,access to shoreline,res_shoreline_access,res_shoreline_access_whi2018.csv," Estimated fishery access land based fishing based on shoreline access (marine managed areas and military areas, type of road (paved, unpaved, private), and steepness of shoreline. ","Estimated fishery access based on shoreline access (marine managed areas and military areas, type of road (paved, unpaved, private), and steepness of shoreline. Shoreline accessibility was calculated based on the same metrics with the same categorical break values as used in the Ocean Tipping Points shore-based fishing layers: Steepness of the shoreline, type of road present within 500 m of the shoreline, and MPA boundaries. Shoreline segments classified as not accessible to fishing due to high cliffs were removed from the analysis. Therefore, all proportions of accessible or not accessible are proportions of non-cliff coastline. Full no-take areas were set to zero access. MPAs that restrict only certain gear types or species are considered accessible/open-to-fishing. Military areas were set to zero access. Data was modified from layers used in the Ocean Tipping Points (http://www.pacioos.hawaii.edu/projects/oceantippingpoints/#data) (Wedding et al 2017).",,,Modified from Ocean Tipping Points,http://www.pacioos.hawaii.edu/projects/oceantippingpoints/#data,Wedding2017,
RC,,annual participation in recreational activities,r_participation,rc_participation_whi2018.csv,"The annual participation rate in ocean and coastal activities from the NOAA Coral Reef Conservation Program 2014 socioeconomic surveys of human use, knowledge, attitudes, and perceptions in Hawaii. ",,"The monthly participation rate in ocean and coastal activities from the NOAA Coral Reef Conservation Program 2014 socioeconomic surveys of human use, knowledge, attitudes, and perceptions in Hawaii (Gorstein et al., 2018). Activity categories include: any ocean activity, beach recreation, boating, camping, canoe or kayaking, diving (scuba or free diving), snorkeling, swimming/wading, and wave riding. Data is for 2016 as this was the first year of this assessment and responses to the survey are representative for Hawaii Island. NOAA Socio-economic division began surveys to track the frequency of recreational activities in Hawai’i in 2016 and these surveys are planned to be repeated every 5-7 years. Raw data is available here: https://github.com/OHI-Science/whi/tree/master/prep_whi/SP/Eva_Schemmel_NCRMP_Hawaii_data/Hawaii. This data was obtained through a formal data request to NOAA through contact Jarrod Loerzel (jarrod.loerzel@noaa.gov). ",,NOAA Coral Reef Conservation Program ,,EdwardsPLoerzelJLevineA2014,
PRESSURE,,aquarium fishing,fis_aquarium_catch,fis_aquarium_catch_whi2018.csv,"The pressure on the nearshore from aquarium fishing estimated as the reported take to DAR, standardized to km2 of hard bottom habitat.","The pressure on the nearshore from aquarium fishing estimated as the reported take to DLNR-DAR, standardized to km2 of hard bottom habitat. Hard bottom habitat layer is from the cumulative impact mapping layers that combine hard bottom and coral reef habitats to a depth of 30 meters (Lecky, 2016).",,,Ocean Tipping Points/DLNR-DAR,http://www.pacioos.hawaii.edu/projects/oceantippingpoints/#data,Wedding2017,OTP
FP,MAR,area of active fishponds,mar_fishpond_current,mar_fishpond_current_whi2018.csv,"The area of current fishponds per West Hawaii Region region, in the process of updating this metric with KUA and TNC.","The area and number of current fishponds for each West Hawaii region. Layer prepared by Ogden Environmental Services 1994 (Ogden Environmental Services, 1994). This layer is being updated by The Nature Conservancy. The total updated number of fishponds for Hawaii Island is 53, including many different types of fishponds, and the historic number of fishponds from the 1990 study lists 138 fishponds for Hawaii Island (DHM inc et al., 1990).",2017,2017,TNC updated fishpond layer,,OgdenEnvironmentalServices1994,
TR,,average daily visitor spending,st_visitor_spending,st_visitor_spending_whi2018.csv,Annual average and percent change in daily visitor spending.,"Two metrics are provided, the annual average and percent change in daily visitor spending from 2012 to 2016. Data are pooled from the Annual Visitor Research Report (http://dbedt.hawaii.gov/visitor/visitor-research/) Table 1. Summary of Visitor Statistics. Additional detailed data comes from DBEDT state databooks section 7 “recreation and travel.” Databooks available at: http://dbedt.hawaii.gov/economic/databook/db2016/. ",2012,2016,DBEDT,http://dbedt.hawaii.gov/economic/databook/db2016/,DBEDT,
BD,HAB,beach condition,hab_health_whi,hab_health_whi2018.csv,The condition of coastal habitats measured as the percent of beaches eroding per region.,The condition of coastal habitats measured as the percent of beaches eroding per region. Data comes from a US Geological Survey of beaches in Hawai’i (Fletcher et al. 2012).,2000,2001,"Fletcher, C.H., Romine, B.M., Genz, A.S., Barbee, M.M., Dyer, Matthew, Anderson, T.R., Lim, S.C., Vitousek, Sean, Bochicchio, Christopher, and Richmond, B.M., 2012, National assessment of shoreline change: Historical shoreline change in the Hawaiian Islands: U.S. Geological Survey Open-File Report 2011_1051, 55 p. (Also available at http:// pubs.usgs.gov/of/2011/1051.)",http://pubs.usgs.gov/of/2011/1051,Fletcher2012a,
BD,HAB,beach extent,hab_extent_whi,hab_extent_whi2018.csv,"Beach extent was calculated from the from ESI GIS layer (Beaches (3,4,5 classifications)). The data units are in km not km2 like other habitats.","Beach extent was calculated from NOAA Office of Response and Restoration Environmental Sensitivity Index (ESI) Maps (https://response.restoration.noaa.gov/maps-and-spatial-data/environmental-sensitivity-index-esi-maps.html) as the total length of beaches per West Hawai’i region by summing the beach extents classified in the ESI as categories 3,4,5. The data units are in km.",2000,2001,NOAA ESI ,https://response.restoration.noaa.gov/maps-and-spatial-data/download-esi-maps-and-gis-data.html,NOAAa,
BD,HAB,beach trend,hab_trend_whi,hab_trend_whi2018.csv,"The average short-term erosion rate of beaches, estimated at -0.06 m per year.","The average short-term erosion rate of beaches, estimated at -0.06 m per year. Data comes from a US Geological Survey of beaches in Hawai’i (Fletcher et al. 2012).",,,"Fletcher, C.H., Romine, B.M., Genz, A.S., Barbee, M.M., Dyer, Matthew, Anderson, T.R., Lim, S.C., Vitousek, Sean, Bochicchio, Christopher, and Richmond, B.M., 2012, National assessment of shoreline change: Historical shoreline change in the Hawaiian Islands: U.S. Geological Survey Open-File Report 2011_1051, 55 p. (Also available at http:// pubs.usgs.gov/of/2011/1051.)",https://pubs.usgs.gov/of/2011/1051/pdf/ofr2011-1051_report_508.pdf,Fletcher2012a,
FP,FIS,bottom fisheries commercial catch,fis_deep_catch,fis_bottom_catch_whi2018.csv,Bottom fish catch (lbs.) reported in the commercial fishery.,"Bottom fish catch (lbs.) reported in the commercial fishery summarized by West Hawai’i region. Data comes from DLNR DAR by official data request. Annual catch data is reported to species and region (North West Hawaii (DAR commercial reporting blocks 123, 122, 103, and 102) and South West Hawaii (DAR commercial reporting blocks 121, 120, 101, and 100) from 2012-2017. Raw data available: https://github.com/OHI-Science/whi/blob/master/prep_whi/FIS/FW%253a_fisheries_data_request/ciwhiispecies2012_2017.xls.",,,DLNR-DAR,http://dlnr.hawaii.gov/dar/fishing/commercial-fishing/,DLNRDAR,
RESILIENCE,,coastal area,lsp_area_1km_coast,lsp_area_1km_coast_whi2018.csv,The terrestrial area within 1 km of the shoreline.,The terrestrial or land area within 1 km of the shoreline. The coastline buffer was generated using the State of Hawaiʻi coastline GIS layer available at Hawai’i State Office of Planning Hawai’i Statewide GIS Program Geospatial Data Portal (www.geoportal.hawaii.gov).,,,,http://geoportal.hawaii.gov/datasets/marine-managed-areas-dar?geometry=-165.4%2C19.079%2C-149.745%2C22.671,OfficeofPlanning,
BD,HAB,coastal wetland condition,hab_health_whi,hab_health_whi2018.csv,Wetland condition was calculated based on percent of historical extent.,"Wetland condition was calculated based on percent of historical extent (Van Rees & Reed, 2014).",2014,2014,"Van Rees, CB and Reed M (2014) Wetland loss in Hawaii since human settlement. Wetlands 34:335-350",https://www.researchgate.net/profile/J_Reed/publication/259637070_Wetland_Loss_in_Hawai'i_Since_Human_Settlement/links/54202e380cf241a65a1b0d1c.pdf,VanRees2014,
BD,HAB,coastal wetland extent,hab_extent_whi,hab_extent_whi2018.csv,The area of coastal wetlands (within 1 km of the coastline).,Area of coastal wetlands within 1 km of the coastline. The wetlands data come from the NOAA C-CAP 2010/2011 hi-resolution GIS layer (https://coast.noaa.gov/digitalcoast/tools/lca). Palustrine and estuarine land cover classifications were summarized by West Hawai’i region within the 1km buffer of the coastline. The coastline buffer was generated using the State of Hawaiʻi coastline GIS layer available at Hawai’i State Office of Planning Hawai’i Statewide GIS Program Geospatial Data Portal (www.geoportal.hawaii.gov).,,,NOAA C-CAP 2010/2011,https://coast.noaa.gov/ccapatlas/,NOAA,
BD,HAB,coastal wetland trend,hab_trend_whi,hab_trend_whi2018.csv,The annual percent change in wetland extent based on NOAA C-CAP data comparisons from 2005 to 2010/2011 clipped to 1 km from the shoreline.,The annual percent change in wetland extent based on NOAA C-CAP data comparisons from 2005 to 2010/2011 (https://coast.noaa.gov/digitalcoast/tools/lca) clipped to 1 km from the shoreline.,,,NOAA C-CAP ,https://coast.noaa.gov/ccapatlas/,NOAA,
FP,FIS,commercial coastal pelagic fisheries catch,fis_coast_pelagic_catch,fis_cp_catch_whi2018.csv,Coastal pelagic fish catch (lbs.) reported in the commercial fishery.,"The coastal pelagic fish catch (lbs.) reported in the commercial fishery. Data comes from DLNR DAR by official data request. Annual catch data is reported to species and region (North West Hawaii (DAR commercial reporting blocks 123, 122, 103, and 102) and South West Hawaii (DAR commercial reporting blocks 121, 120, 101, and 100) from 2012-2017. Raw data available: https://github.com/OHI-Science/whi/blob/master/prep_whi/FIS/FW%253a_fisheries_data_request/ciwhiispecies2012_2017.xls.",,,DLNR-DAR,http://dlnr.hawaii.gov/dar/fishing/commercial-fishing/,DLNRDAR,
FP,FIS,commercial reef fisheries catch,fis_reef_catch,fis_reef_catch_whi2018.csv,Reef fish and invertebrate catch (lbs.) reported in the commercial fishery.,"The reef fish and invertebrate catch (lbs.) reported in the commercial fishery. Data comes from DLNR DAR by official data request. Annual catch data is reported to species and region (North West Hawaii (DAR commercial reporting blocks 123, 122, 103, and 102) and South West Hawaii (DAR commercial reporting blocks 121, 120, 101, and 100) from 2012-2016.",,,DLNR-DAR,http://dlnr.hawaii.gov/dar/fishing/commercial-fishing/,DLNRDAR,
RESILIENCE,,conservation districts,lsp_coastal_conservation,lsp_coastal_conservation_whi2018.csv,The area and type of conservation districts within 1km of the coastline.,"The area (km2) and type of conservation districts (Protective (P), Limited (L), Resource (R), General (G), and Special (SS)) within 1 km of the coastline for each West Hawaii Region. Data comes from DLNR-OCCL and is available on the Hawai’i State Office of Planning Hawai’i Statewide GIS Program Geospatial Data Portal (www.geoportal.hawaii.gov).",,,DLNR -OCCL,http://geoportal.hawaii.gov/datasets/marine-managed-areas-dar?geometry=-165.4%2C19.079%2C-149.745%2C22.671,OfficeofPlanning,
PRESSURE,,coral bleaching threat,cc_sst_nearshore,cc_sst_nearshore_whi2018.csv,"Mean degree heating weeks (DHW) for nearshore areas (within 10 km of the coastline), with coral bleaching expected after 4 DHW.  Scores of 1 indicate that coral bleaching is expected or occurred. ","Mean degree heating weeks (DHW) for nearshore areas (within 10 km of the coastline), with a coral bleaching threshold of 4 DHW. Scores of 1 indicate that coral bleaching is expected or occurred. Data acquired from the NOAA Coral Reef Watch (https://coralreefwatch.noaa.gov/satellite/bleaching5km/index_5km_dhw.php).",,,NOAA Coral Reef Watch,https://coralreefwatch.noaa.gov/satellite/bleaching5km/index_5km_dhw.php,NOAASateliteandInformationService,
TR,,environmental protection,t_env_sus,t_env_sus_whi2018.csv,The percent of nearshore areas and priority watersheds protected.,"The percent of nearshore areas and priority watersheds protected. The percent of nearshore waters protected was assessed as the ratio of the area of marine managed areas per West Hawaii region, excluding the NOAA Marine Mammal Sanctuary Waters (NOAA Marine Protected Area (MPA) Inventory) spatial data layer available: http://geoportal.hawaii.gov/datasets/noaa-marine-protected-area-mpa-inventory) to the total area of state waters (coastline to 3nm) within each West Hawaii region. The percent of watersheds is the percent of Hawaii Island priority watersheds that have been fenced. Data comes from Emma Yuen DLNR/DOFAW. ",2011,2016,DLNR,http://geoportal.hawaii.gov/datasets/marine-managed-areas-dar?geometry=-165.4%2C19.079%2C-149.745%2C22.671,OfficeofPlanning,
BD,SPP,ESA coastal plant status,spp_ESA_status,spp_ESA_status.csv,The list of Hawaii coastal plant species and status of coastal sand-dune plants scored based on ESA status.,"The list of Hawaii coastal plant species and status of coastal sand-dune plants scored based on ESA status. Species lists and classification comes from (Merlin, 1999)Merlin 1999. ESA data comes from the US Fish and Wildlife Service ECOS Environmental Conservation Online System (https://ecos.fws.gov/ecp/).",,,Fish and Wildlife Service,https://ecos.fws.gov/ecp/,Merlin1999,USFishWildlifeService
BD,SPP,ESA marine mammal status,spp_ESA_status,spp_ESA_status.csv,The list of marine mammals found in Hawaii and status of marine mammals scored based on ESA status.,The list of marine mammals found in Hawaii and status of marine mammals scored based on ESA status. ESA status is for Hawaii or regional populations and population status reports can be found at NOAA Fisheries (http://www.nmfs.noaa.gov/pr/sars/species.htm). ,,,US Fish and Wildlife Service; NOAA Hawaii marine mammal list,http://www.fisheries.noaa.gov/pr/sars/species.htm#largewhales; https://ecos.fws.gov/ecp/,NOAAFisheries,Costa2016
BD,SPP,ESA seabird and coastal bird status,spp_ESA_status,spp_ESA_status.csv,The list of seabirds and coastal birds scored based on ESA status and State of the Birds watch lists.,The list of seabirds and coastal birds scored based on ESA status and State of the Birds watch lists. Species lists and status from Coasta and Kendall 2016. ESA data comes from the US Fish and Wildlife Service ECOS Environmental Conservation Online System (https://ecos.fws.gov/ecp/) and the State of the Birds Watch List (Rosenberg et al. 2014). Species scores are based on ESA status and watch list status. ,,,"Costa, Bryan; Kendall, Matthew (2016). Marine Biogeographic Assessment of the Main Hawaiian Islands: Synthesized physical and biological data offshore of the Main Hawaiian Islands from 1891-01-01 to 2015-03-01 (NCEI Accession 0155189). Version 1.1. NOAA National Centers for Environmental Information. Dataset. doi:10.7289/V56H4FG9 May 15, 2017",http://www.stateofthebirds.org/2014/extinctions/watchlist.pdf; https://www.fws.gov/endangered/,Rosenberg2010,USFishWildlifeService
FP,MAR,fishpond status,mar_fishpond_health,mar_fishpond_health_whi2018.csv,"Ratio of active fishponds to historical number, process of updating this metric with KUA and TNC.","Ratio of active fishponds to historical number, process of updating this metric with KUA and TNC.",,,TNC updated fishpond layer,,OgdenEnvironmentalServices1994,
CW,,forest health,hd_allien_veg,hd_allien_veg_whi2018.csv,The percent of native forests dominated by non-native species.,"The percent of native forests dominated by non-native species. All calculations based on LandFire 2014 data (LF 1.4.0), 30m resolution. Albers equal area conic projection. Data were summarized by watershed and are presented as percent total alien vegetation per watershed (hd_allien_vg_by_watershed_whi2018.csv) and averaged across watersheds for each West Hawai’i region (hd_allien_vg_whi2018.csv). Watershed data from USGS National Hydrography Dataset Watershed Boundaries (HUC12).",,,Landfire,https://www.landfire.gov/about.php,LANDFIRE2008,
PRESSURE,,habitat destruction from dredging,hd_dredging,hd_dredging_whi2018.csv,Dredging was defined as activity involving physically removing substrate with machinery typically to allow for safe passage of vessels. Units are in km2.,Dredging was defined as activity involving physically removing substrate with machinery typically to allow for safe passage of vessels. Dredging was summarized to soft bottom coastal areas within state waters. Data comes from Ocean Tipping Points (http://www.pacioos.hawaii.edu/projects/oceantippingpoints/#data). Units are in km2.,,,Ocean Tipping Points,http://www.pacioos.hawaii.edu/projects/oceantippingpoints/#data,Wedding2017,OTP
CW,,land-based sediment export to nearshore water,po_lbsp_sed,po_lbsp_sed_whi2018.csv,Mean sediment load to nearshore waters (1.5km).,Mean sediment load to nearshore waters (1.5 km) averaged to West Hawaiʻi regions. Data comes from Ocean Tipping Points (http://www.pacioos.hawaii.edu/projects/oceantippingpoints/#data).,,,Ocean Tipping Points,http://www.pacioos.hawaii.edu/projects/oceantippingpoints/#data,Wedding2017,OTP
CW,,land-based source of pollution from agriculture and golf courses,po_lbspaggolfrunoff,po_lbspaggolfrunoff_whi2018.csv,"The proxy for agricultural and landscaping runoff (nutrients from fertilizers; chemicals like pesticides and herbicides), calculated as the area of agricultural land and golf courses by watershed with a maximum. stressor level set at 10% of watershed area.",The proxy for agricultural and landscaping runoff (nutrients from fertilizers; chemicals like pesticides and herbicides). Data were summarized by watershed and are presented as the ratio of the area of agricultural land and golf courses by watershed (full data in layers_whi/watershed_land_use_whi2018.csv) to the maximum stressor value of 10% of watershed area. Mean watershed scores are given for West Hawai’i regions. Watershed data from USGS National Hydrography Dataset Watershed Boundaries (HUC12). Agriculture and golf course data comes from the NOAA C-CAP 2010/2011 hi-resolution GIS layer (https://coast.noaa.gov/digitalcoast/tools/lca).,,,Ocean Tipping Points,http://www.pacioos.hawaii.edu/projects/oceantippingpoints/#data,Wedding2017,OTP
CW,,land-based source of pollution from urban runoff,po_lbspurbanrunoff,po_lbspurbanrunoff_mhi2017.csv,A proxy for nutrient and chemical pollution measured as the percent of impervious surfaces per watershed with a maximum stress level set at 10% of watershed area.,The proxy for nutrient and chemical pollution. Data were summarized by watershed (full data in layers_whi/watershed_land_use_whi2018.csv) and are presented as the ratio of impervious surfaces by watershed set to the maximum stressor value of 10% of watershed area. Mean watershed scores are given for West Hawai’i regions. Watershed data from USGS National Hydrography Dataset Watershed Boundaries (HUC12). Impervious surface data comes from the NOAA C-CAP 2010/2011 hi-resolution GIS layer (https://coast.noaa.gov/digitalcoast/tools/lca).,,,Ocean Tipping Points,http://www.pacioos.hawaii.edu/projects/oceantippingpoints/#data,Wedding2017,OTP
CW,,land-based source of pollution nitrogen,po_lbsp_nosds,po_lbsp_nosds_whi2018.csv,Mean nitrogen flux from on site disposal systems (OSDS) into nearshore waters (1.5 km from shore).,Mean nitrogen flux from on-site disposal systems (OSDS) into nearshore waters (1.5 km from shore). Data comes from Ocean Tipping Points (http://www.pacioos.hawaii.edu/projects/oceantippingpoints/#data).,,,modified from Ocean Tipping Points,http://www.pacioos.hawaii.edu/projects/oceantippingpoints/#data,Wedding2017,OTP
FP,MAR,mariculture yield,mar_harvest,mar_harvest_whi2018.csv,"Production of shellfish and foodfish from mariculture facilities, assumes that all Hawaii Island operators are in West Hawaii.","Production of shellfish and foodfish from mariculture facilities from Hawaii Island. The production (yield: lbs. of seafood) is reported at the state level (HDA). To get county level estimates of production the yield of finfish and shellfish produced at the state level were multiplied by the estimated number of finfish and shellfish operators by county. The number of operators are reported to USDA via census every 5 years (2002, 2007, 2012) (USDA). To fill in annual data gaps in operators, linear regression models were used. Data are reported from 2007-2011. An additional data layer is in the prep_WH folder under the MAR folder “mar_harvest_state_of_hawaii.csv” and has the full data for the State of Hawaii which includes pounds (lbs), tonnes, and value (dollar value) of yield from shellfish and finfish mariculture. ",2007,2011,State of Hawaii DOA,http://hdoa.hawaii.gov/,USDA2015,
RC,,monthly participation in recreational activities,rc_participation,r_participation_whi2018.csv,"The monthly participation rates in any ocean or coastal activity for Hawaii Island residents. The NOAA Coral Reef Conservation Program 2014 socioeconomic surveys of human use, knowledge, attitudes, and perceptions in Hawaii.","The annual participation rate in any ocean and coastal activity from the NOAA Coral Reef Conservation Program 2014 socioeconomic surveys of human use, knowledge, attitudes, and perceptions in Hawaii (Gorstein et al., 2018). Data is for 2016 as this was the first year of this assessment and responses to the survey are representative for Hawaii Island. Socio-economic division began surveys to track the frequency of recreational activities in Hawai’i in 2016 and these surveys are planned to be repeated every 5-7 years. Raw data is in the prep_WHI folder under SP and in the folder Eva_Schemmel_NCRMP_Hawaii_data. This data was obtained through a formal data request to NOAA through contact Jarrod Loerzel (jarrod.loerzel@noaa.gov). ",,,NOAA Coral Reef Conservation Program ,,EdwardsPLoerzelJLevineA2014,
RESILIENCE,,nearshore management areas,lsp_mpa_3nm,lsp_mpa_3nm_whi2018.csv,"The area of marine managed areas (including BFRA, MPA, FMA).","The area of nearshore waters protected was assessed as the area of marine managed areas per West Hawaii region, excluding the NOAA Marine Mammal Sanctuary Waters (NOAA Marine Protected Area (MPA) Inventory) spatial data layer available: http://geoportal.hawaii.gov/datasets/noaa-marine-protected-area-mpa-inventory).",,,"NOAA MPA spatial data layer (management areas include no take, multiple use, national parks, and santucary waters",http://geoportal.hawaii.gov/datasets/marine-managed-areas-dar?geometry=-165.4%2C19.079%2C-149.745%2C22.671,OfficeofPlanning,
RESILIENCE,,nearshore state waters,lsp_area_3nm,lsp_area_3nm_whi2018.csv,The area of state waters (within 3nm of the coastline).,The total area of state waters (coastline to 3nm) within each West Hawaii region.,,,,http://geoportal.hawaii.gov/datasets/marine-managed-areas-dar?geometry=-165.4%2C19.079%2C-149.745%2C22.671,OfficeofPlanning,
FP,MAR,number of fishponds ,mar_fishpond_numbers,mar_fishpond_numbers_whi2018.csv,"The current number of fishponds, in the process of updating this metric with KUA and TNC.","The current number fishponds in each West Hawaii region. Layer prepared by Ogden Environmental Services 1994 (Ogden Environmental Services, 1994). This layer is being updated by The Nature Conservancy. The total updated number of fishponds for Hawaii Island is 53, including many different types of fishponds, and the historic number of fishponds from the 1990 study lists 138 fishponds for Hawaii Island (DHM inc et al., 1990).",2017,2017,TNC updated fishpond layer,,OgdenEnvironmentalServices1994,
